,title,media,date,datetime,desc,link,img,content
6,"Shipping Speed, Transparency Continue To Trip Up e ...",Benzinga,3 hours ago,2021-05-03 17:30:03.389255,"... Walmart (NYSE: WMT) at 40%; eBay (NASDAQ: EBAY) and Target (NYSE: TGT), 18% each; and Kohl's (NYSE: KSS) and Apple (NASDAQ: AAPL), 10% each.",https://www.benzinga.com/news/earnings/21/05/20912096/shipping-speed-transparency-continue-to-trip-up-e-commerce-brands,"data:image/gif;base64,R0lGODlhAQABAIAAAP///////yH5BAEKAAEALAAAAAABAAEAAAICTAEAOw==","The retail customer journey has been changed forever. No longer is going to a physical store and browsing the aisles the only method of shopping. More browsing than ever is taking place online, more sales than ever are occurring in digital spaces and more pressure on retailers is driving change – and new challenges – that continue to alter the shopping experience.

Understanding these changes are key to creating successful customer journeys. More importantly, though, is understanding what the modern consumer seeks. A series of recent reports provide some insights into the consumer of 2021 and what they say is important to them, giving retailers and brands a road map to fulfilling consumer needs.

The Face Of The Online Consumer

In Jungle Scout's Q1 2021 Consumer Trends Report, consumers reported that free shipping was the top reason to shop online. That jumped up from the fourth spot in the Q4 report, suggesting shipping cost was less of a factor during the busy holiday season. Lower prices, which was sixth in the Q4 report, jumped up to No. 2 in Q1. Convenience was third in Q1 after topping the survey in Q4.

The report, which surveyed 1,005 U.S. consumers Jan. 26-29, 2021, found that 46% of consumers leave items in their online cart and forget about them, suggesting brands have some work to do to convert these customers.

When it comes to which online retailers are most popular, it's no surprise that Amazon (NASDAQ: AMZN) topped the list, with 73% of respondents saying they shopped at Amazon.com at least once in the past three months. Amazon was followed by Walmart (NYSE: WMT) at 40%; eBay (NASDAQ: EBAY) and Target (NYSE: TGT), 18% each; and Kohl's (NYSE: KSS) and Apple (NASDAQ: AAPL), 10% each.

When it comes to returns, 31% of respondents said they would return a product bought from an online store. That number increased slightly, to 32% for Amazon shoppers, but both numbers remained below the 37% who said they were likely to return an item at a physical store.

Consumers looking for items often start with Amazon, with 74% of them saying that is their first online stop. Search engines were popular as well, with 65% saying that's where they start researching items. A brand or retailer's website was cited by 38% followed by social networks Facebook, 31%; YouTube, 29%; Instagram, 21%; and TikTok, 10%. (Note: Respondents could select multiple answers.)

When it comes to getting a product in a timely manner, though, the clear choice is Amazon, with 64% saying they turn to Jeff Bezo's platform.

Nearly three-quarters of consumers – 73% – believe the majority of shopping will happen online in the future and 43% said they would be fine if they never shopped in a physical store again. A full 58% of consumers shop online at least once a week if not more.

When it comes to price and shipping considerations, 68% of all consumers said they are looking online for the item with the lowest price, but 48% said they would pay more for that item if it came with faster shipping. Interestingly, of Amazon shoppers, 55% said they would pay more for faster shipping even though the company already offers free shipping for most items for Prime members.

A SOTI Bricks to Clicks report found that last-mile delivery remains the most inefficient part of the entire e-commerce supply chain for 59% of U.S. transportation and logistics companies. Yet for the consumer, that piece remains a critical part of the online buying experience.

In a survey of 6,000 consumers conducted by Arlington Research for mobile technology platform SOTI during Q4 2020, 67% of consumers said they wanted real-time visibility into the location of their Christmas gifts from the moment the online order was processed. Delays in delivery exceeding two days turned off 38% of consumers, who said they would look elsewhere for the product in those cases, and 57% said they were frustrated with the returns process for online orders.

Delivery experience management company Convey conducted its own survey on Amazon, building the results into a recent webinar, ""Amazon's Momentum and Retailer's Moment of Opportunity."" The company's survey found 6 in 10 consumers were more likely to complete a purchase if the estimated delivery date was visible in the product card prior to checkout.

Read: Taking the measure of returns: 5 questions for FedEx's Ryan Kelly

""It's very much an Amazon takeaway experience,"" Carson Krieg, co-founder and head of strategic partnerships at Convey, said during the webinar.

Almost half of consumers (47%) said they would like the ability to pick up an online order at a physical store on the same day if the retailer had a store location nearby. That theme came through in the SOTI report as well.

""When they are under pressure, whether online or in-store, customers want a high-quality and tailored experience,"" the SOTI report said. ""But they also want maximum simplicity and convenience. We can expect these trends to spill over from the holiday experience into the rest of the year.""

The Convey survey was conducted in December 2020 at the height of the holiday shopping season and asked 1,200 consumers 15 questions. The results showed that consumers have mixed feelings about Amazon – even as the e-tail giant continues to drive supply chain innovation and alter consumer demands. While 19.9% had a ""very negative"" view of Amazon's impact on retail and another 28.6% held a negative view, 49% of shoppers said they preferred to shop with Amazon because they trusted their package would be delivered on time.

Despite the negative views of Amazon, 28% of respondents reported making at least half their purchases on Amazon.com.

Krieg said this indicates the importance of a strong fulfillment program for all brands, not just Amazon.

""2020 was a test for all retailers including Amazon,"" he said during the Convey webinar. ""Amazon had similar capacity constraints and restrictions as brick and mortar did … but what did they do is they hired workers … and they made the tough decision to turn off their FBA (Fulfilled by Amazon) program.""

Throughout the Convey survey, the theme of cost and shipping continued to appear. Respondents said they would choose Amazon over a smaller retailer due to cost of items, with 33.7% saying items were more expensive at the other retailers. Additionally, 23.3% said shipping was either more expensive or wasn't free at the smaller businesses, while 22.1% said shipping was going to take longer.

""Some consumers were willing to wait longer for shipping … if it's free,"" Krieg noted.

Amazon Prime members were also more likely to be wealthier shoppers. According to Convey's data, of those with household incomes above $75,000 per year, 41% bought half of their goods from Amazon, and the shipping experience was ""very important"" for 64% of them. Even though 33% of these shoppers shopped exclusively at Amazon for the holidays, 24% said Amazon was having a negative impact on retailers.

Krieg said the lessons learned from the Convey surveys are clear: Brands not selling on Amazon need to step up their delivery games.

Amazon is now fulfilling more than 50% of its package deliveries, Krieg said, and while ""a lot of retailers are not going to have the scale to do that,"" the benefits Amazon has gained from it are clear – and they are pushing others to match it.

""Two-thirds of the country (68%) is saying that if you screw up the first [delivery], we're not going to give you another shot,"" Krieg said.

What Can Retailers Do?

Krieg advised retailers to offer in-store and curbside pickup where possible and be proactive with communications to customers.

""You can be brand forward and capitalize on the opportunity by sending more alerts around certain shipments,"" Krieg said, noting that packages delayed by weather or traffic can be alerts. The more touch points with the customer, the better, he added.

Bringing all communications and data streams – from distribution centers to delivery networks to stores – into a single silo helps this process.

Krieg also said to be vocal about sustainability efforts. He noted that 30% of consumers under the age of 30 believe Amazon is harmful for the environment, and sales of sustainably marketed products grow at 5.6 times the rate of conventional products, according to the Boston Consulting Group.

Show how you are reducing waste by being more efficient through shorter supply chains that reduce emissions or result in less food waste; spotlight how slower – and cheaper – shipping methods can be a sustainable choice, he said.

""The consumer base will pay more for these goods,"" Krieg said.

Shash Anand, vice president of product strategy for SOTI, said that technology offers retailers a pathway to both better shipping experiences and increased trust surrounding the entire purchase.

""Almost half of consumers abandoned online purchase because they didn't trust the site [would secure their data],"" Anand said, noting that 57% were more trusting of well-known brands.

SOTI provides technology that helps protect data privacy as well as improves the shipping process, including returns.

""Delivery [and returns] is not only an option but a must,"" Anand said. ""Sixty-three percent of consumers would like the returns process to be easier if not automated [entirely]. This is an opportunity for retailers to perfect their game.""

Anand said retailers should evaluate technologies and look to use cases that will show how the technology works in real-world applications. This can include mobile devices, RFID, scanners, wearables and drones.

""There are many companies that have gotten this right and they are doing extremely well and thriving in this economy,"" he said.

Technology deployment should take into consideration customer privacy and speed of delivery – and shipment tracking is a must-have that customers have come to expect. Anand said retailers need to become technology companies since the customer journey now includes the shopping experience, the payment experience and the delivery experience. Falling down in any one area can drive a customer away forever.

Click for more Modern Shipper articles by Brian Straight.

You may also like:

Bringg's collaboration with Uber opens new doors for e-commerce"
7,AAPL: What Does A Huge Jump in Capital Gains Taxes Mean ...,StockNews,3 hours ago,2021-05-03 17:30:03.398237,AAPL – The President is looking to increase the capital gains tax for those earning over $1 million per year. With some of the top tech companies such as Apple ( ...,https://stocknews.com/news/aapl-amzn-googl-msft-what-does-a-huge-jump-in-capital-gains-taxes-mean/,"data:image/gif;base64,R0lGODlhAQABAIAAAP///////yH5BAEKAAEALAAAAAABAAEAAAICTAEAOw==","AAPL – The President is looking to increase the capital gains tax for those earning over $1 million per year. With some of the top tech companies such as Apple (AAPL), Amazon (AMZN), Alphabet (GOOGL), and Microsoft (MSFT) seeing massive gains over the past year, what does an increase in capital gains mean for investors holding those stocks. Read more to find out."
8,AAPL Has Its Earnings Estimate For Q4 2021 By Oppenheimer |,Digital Market News,4 hours ago,2021-05-03 16:30:03.414343,"(NASDAQ: AAPL) had their EPS estimates for Q4 2021 increased by Oppenheimer analysts on 29th April, Thursday. M. Yang, the Oppenheimer analyst, expects ...",https://www.digitalmarketnews.com/aapl-has-its-earnings-estimate-q4-2021/,"data:image/gif;base64,R0lGODlhAQABAIAAAP///////yH5BAEKAAEALAAAAAABAAEAAAICTAEAOw==","Apple Inc. (NASDAQ: AAPL) had their EPS estimates for Q4 2021 increased by Oppenheimer analysts on 29th April, Thursday. M. Yang, the Oppenheimer analyst, expects Apple Inc. to post a $1.14 EPS which is an increase from the previous $1.05.

Several research brokerages have also issued their reports on the AAPL stock. Wedbush increased their objective price to $185 from $175 while issuing a rating of “outperform” on Thursday. JPMorgan Chase & Co. increased their objective price to $165 from $150 while issuing a rating of “overweight” on Thursday. Sandford C. Bernstein issued an objective price of $132 and a rating of “neutral” on 8th March, Monday. Jefferies Financial Group increased its target price to $175 from $160 while issuing a rating of “buy” on Thursday. Finally, UBS Group increased their target price to $155 from $142 while issuing a rating of “buy” on Thursday.

On Monday, AAPL had opened at a value of $131.46. The moving average over 50 days for the stock stands at $127.74 while that for 200 days it is $125.77. The highest and lowest of the stock over a year stands at $145.09 and $71.46. The market capitalization value of the stock is $2.21T with a 1.28 beta. The latest earnings result was announced on 27th April, Tuesday. It posed an EPS of $1.40 overshooting the $0.99 general estimate. A 75.15% equity return and a 20.91% net margin were announced as well.

UBS Asset Management Americas Inc., Nuveen Asset Management LLC, Morgan Stanley, Norges Bank, and FMR LLC. All increased their share of AAPL stocks.

Deirdre O’Brien, the SVP, sold off 18,216 shares on 16th April, Friday at an average $134.01 price per share. Jeffrey E. Williams, the COO, also sold off 133,867 AAPL shares on 5th April, Monday at an average $125.74 price per share."
9,"Pre-Market Most Active for May 3, 2021 : AHT, NOK, AAPL ...",,4 hours ago,2021-05-03 16:30:03.419174,"(AAPL) is +0.54 at $132.00, with 697,091 shares traded. Over the last four weeks they have had 7 up revisions for the earnings forecast, for the fiscal quarter ...",https://www.nasdaq.com/articles/pre-market-most-active-for-may-3-2021-%3A-aht-nok-aapl-nio-sqqq-ebon-mvis-amc-qqq-sos-f-aih,"data:image/gif;base64,R0lGODlhAQABAIAAAP///////yH5BAEKAAEALAAAAAABAAEAAAICTAEAOw==",Missing_Article
0,Microsoft Stock: Is It A Buy Now? Here's What MSFT Stock ...,The Madison Leader Gazette,7 mins ago,,Software giant Microsoft (MSFT) has earned plaudits for its successful pivot from desktop computing to cloud computing. And MSFT stock has risen as a result.,https://wmleader.com/general-other/26295/microsoft-stock-is-it-a-buy-now-heres-what-msft-stock-chart-shows/,"data:image/gif;base64,R0lGODlhAQABAIAAAP///////yH5BAEKAAEALAAAAAABAAEAAAICTAEAOw==",0.0
1,Verizon's recent Yahoo deal proves Microsoft dodge a bullet,,19 mins ago,,"On MSFT. 71.1K subscribers. Subscribe · OnPodcast Episode 32: Sun Valley hidden in Insider build, May 2021 Update almost done, MSFT Earnings. 1/33. Info.",https://www.onmsft.com/news/verizon-took-the-yahoo-bullet-microsoft-missed,"data:image/gif;base64,R0lGODlhAQABAIAAAP///////yH5BAEKAAEALAAAAAABAAEAAAICTAEAOw==",0.0
2,Over 70 new Xbox One games now support FPS Boost on ...,OnMSFT.com,1 hour ago,2021-05-03 19:30:06.288450,Over 70 new Xbox One games now support FPS Boost on Xbox Series X|S consoles · Latest OnPodcast · On MSFT · More videos · More videos on YouTube.,https://www.onmsft.com/news/over-70-new-xbox-one-games-now-support-fps-boost-on-xbox-series-xs-consoles,"data:image/gif;base64,R0lGODlhAQABAIAAAP///////yH5BAEKAAEALAAAAAABAAEAAAICTAEAOw==",0.0
3,Top 10 Keyboard Shortcuts in Windows 10,,2 hours ago,2021-05-03 18:30:06.290443,"On MSFT. 71.1K subscribers. Subscribe · OnPodcast Episode 32: Sun Valley hidden in Insider build, May 2021 Update almost done, MSFT Earnings. 1/33. Info.",https://www.onmsft.com/how-to/top-10-keyboard-shortcuts-in-windows-10,"data:image/gif;base64,R0lGODlhAQABAIAAAP///////yH5BAEKAAEALAAAAAABAAEAAAICTAEAOw==",0.0
4,Microsoft Teams Meetings to get an automatic recording option,,2 hours ago,2021-05-03 18:30:06.292402,"On MSFT. 71.1K subscribers. Subscribe · OnPodcast Episode 32: Sun Valley hidden in Insider build, May 2021 Update almost done, MSFT Earnings. 1/33. Info.",https://www.onmsft.com/news/microsoft-teams-meetings-automatic-recording,"data:image/gif;base64,R0lGODlhAQABAIAAAP///////yH5BAEKAAEALAAAAAABAAEAAAICTAEAOw==",0.0
5,Microsoft Corporation [MSFT] Stock trading around $252.18 ...,The DBT News,2 hours ago,2021-05-03 18:30:06.296876,"Microsoft Corporation [NASDAQ: MSFT] stock went on a downward path that fall over -0.13% on Friday, amounting to a one-week price decrease of less than ...",https://dbtnews.com/2021/05/03/microsoft-corporation-msft-stock-trading-around-252-18-per-share-whats-next/,"data:image/gif;base64,R0lGODlhAQABAIAAAP///////yH5BAEKAAEALAAAAAABAAEAAAICTAEAOw==",0.0
6,Here is why Microsoft Corporation (MSFT) stock volatility ...,Invest Chronicle,3 hours ago,2021-05-03 17:30:06.298870,Here is why Microsoft Corporation (MSFT) stock volatility recorded over the last month was 1.49% · Get the hottest stocks to trade every day before the market ...,https://investchronicle.com/2021/05/03/here-is-why-microsoft-corporation-msft-stock-volatility-recorded-over-the-last-month-was-1-49/,"data:image/gif;base64,R0lGODlhAQABAIAAAP///////yH5BAEKAAEALAAAAAABAAEAAAICTAEAOw==",0.0
7,"Notable ETF Inflow Detected - ESGU, AAPL, MSFT, AMZN",,3 hours ago,2021-05-03 17:30:06.300865,"Among the largest underlying components of ESGU, in trading today Apple Inc (Symbol: AAPL) is up about 1.8%, Microsoft Corporation (Symbol: MSFT) is up ...",https://www.nasdaq.com/articles/notable-etf-inflow-detected-esgu-aapl-msft-amzn-2021-05-03,"data:image/gif;base64,R0lGODlhAQABAIAAAP///////yH5BAEKAAEALAAAAAABAAEAAAICTAEAOw==",0.0
8,Previous Microsoft had plans to reduce its Xbox Store cut to 12%,,3 hours ago,2021-05-03 17:30:06.302860,"On MSFT. 71.1K subscribers. Subscribe · OnPodcast Episode 32: Sun Valley hidden in Insider build, May 2021 Update almost done, MSFT Earnings. 1/33. Info.",https://www.onmsft.com/news/microsoft-had-plans-to-reduce-its-xbox-store-cut-to-12,"data:image/gif;base64,R0lGODlhAQABAIAAAP///////yH5BAEKAAEALAAAAAABAAEAAAICTAEAOw==",0.0
9,Implied XLK Analyst Target Price: $156,,3 hours ago,2021-05-03 17:30:06.305897,"Combined, WDC, NLOK, and MSFT represent 20.15% of the The Technology Select Sector SPDR— Fund ETF. Below is a summary table of the current analyst ...",https://www.nasdaq.com/articles/implied-xlk-analyst-target-price%3A-%24156-2021-05-03,"data:image/gif;base64,R0lGODlhAQABAIAAAP///////yH5BAEKAAEALAAAAAABAAEAAAICTAEAOw==",0.0
