,title,media,date,datetime,desc,link,img,content
0,Apple hires ex-Google AI scientist who resigned after ...,Reuters,25 mins ago,,"Apple Inc (AAPL.O) said on Monday it has hired former distinguished Google (GOOGL.O) scientist Samy Bengio, who left the search giant amid turmoil in its ...",https://www.reuters.com/technology/apple-hires-ex-google-ai-scientist-who-resigned-after-colleagues-firing-2021-05-03/,"data:image/gif;base64,R0lGODlhAQABAIAAAP///////yH5BAEKAAEALAAAAAABAAEAAAICTAEAOw==","Apple Inc (AAPL.O) said on Monday it has hired former distinguished Google (GOOGL.O) scientist Samy Bengio, who left the search giant amid turmoil in its artificial intelligence research department.

Bengio is expected to lead a new AI research unit at Apple under John Giannandrea, senior vice president of machine learning and AI strategy, two people familiar with the matter said. Giannandrea joined Apple in 2018 after spending about eight years at Google.

Bengio who left Google last week after about 14 years said last month he was pursuing ""other exciting opportunities"".

His decision followed Google's firings of fellow scientists Margaret Mitchell for taking company data and Timnit Gebru after an offer to resign. Mitchell and Gebru had co-led a team researching ethics issues in AI, and had voiced concern about Google's workplace diversity and approach to reviewing research. Bengio had expressed support for the pair. read more

As one of the early leaders of the Google Brain research team, Bengio advanced the ""deep learning"" algorithms that underpin today's AI systems for analyzing images, speech and other data."
1,8 Information Technology Stocks Showing Unusual Options ...,,59 mins ago,,"Regarding AAPL (NASDAQ:AAPL), we observe a call option sweep with bearish sentiment. It expires in 4 day(s) on May 7, 2021. Parties traded 438 contract(s) ...",https://www.benzinga.com/markets/options/21/05/20919669/8-information-technology-stocks-showing-unusual-options-activity-in-todays-session,"data:image/gif;base64,R0lGODlhAQABAIAAAP///////yH5BAEKAAEALAAAAAABAAEAAAICTAEAOw==","This unusual options alert can help traders track potentially big trading opportunities. Traders often look for circumstances when the market estimation of an option diverges away from its normal worth. Unusual trading activity could push option prices to hyperbolic or underperforming levels.

Below are some instances of unusual options activity happening in the Information Technology sector:



These bullet-by-bullet explanations have been constructed using the accompanying table.
• Regarding AAPL (NASDAQ:AAPL), we observe a call option sweep with bearish sentiment. It expires in 4 day(s) on May 7, 2021. Parties traded 438 contract(s) at a $134.00 strike. This particular call needed to be split into 9 different trades to become filled. The total cost received by the writing party (or parties) was $32.8K, with a price of $75.0 per contract. There were 23132 open contracts at this strike prior to today, and today 50362 contract(s) were bought and sold.
• For MU (NASDAQ:MU), we notice a put option trade that happens to be bullish, expiring in 263 day(s) on January 21, 2022. This event was a transfer of 1000 contract(s) at a $50.00 strike. The total cost received by the writing party (or parties) was $103.0K, with a price of $103.0 per contract. There were 10091 open contracts at this strike prior to today, and today 2253 contract(s) were bought and sold.
• Regarding AMD (NASDAQ:AMD), we observe a call option trade with bearish sentiment. It expires in 74 day(s) on July 16, 2021. Parties traded 200 contract(s) at a $80.00 strike. The total cost received by the writing party (or parties) was $96.9K, with a price of $485.0 per contract. There were 8566 open contracts at this strike prior to today, and today 1220 contract(s) were bought and sold.
• Regarding MSFT (NASDAQ:MSFT), we observe a put option trade with bullish sentiment. It expires in 109 day(s) on August 20, 2021. Parties traded 650 contract(s) at a $220.00 strike. The total cost received by the writing party (or parties) was $227.5K, with a price of $350.0 per contract. There were 1391 open contracts at this strike prior to today, and today 1108 contract(s) were bought and sold.
• Regarding APP (NASDAQ:APP), we observe a put option trade with bullish sentiment. It expires in 109 day(s) on August 20, 2021. Parties traded 1000 contract(s) at a $50.00 strike. The total cost received by the writing party (or parties) was $310.0K, with a price of $310.0 per contract. There were 0 open contracts at this strike prior to today, and today 1000 contract(s) were bought and sold.
• For SNOW (NYSE:SNOW), we notice a call option sweep that happens to be bearish, expiring in 263 day(s) on January 21, 2022. This event was a transfer of 516 contract(s) at a $440.00 strike. This particular call needed to be split into 32 different trades to become filled. The total cost received by the writing party (or parties) was $335.7K, with a price of $650.0 per contract. There were 1471 open contracts at this strike prior to today, and today 516 contract(s) were bought and sold.
• For AKAM (NASDAQ:AKAM), we notice a put option sweep that happens to be bearish, expiring in 4 day(s) on May 7, 2021. This event was a transfer of 295 contract(s) at a $108.00 strike. This particular put needed to be split into 25 different trades to become filled. The total cost received by the writing party (or parties) was $109.1K, with a price of $370.0 per contract. There were 29 open contracts at this strike prior to today, and today 509 contract(s) were bought and sold.
• Regarding FSLR (NASDAQ:FSLR), we observe a call option sweep with bullish sentiment. It expires in 263 day(s) on January 21, 2022. Parties traded 209 contract(s) at a $100.00 strike. This particular call needed to be split into 24 different trades to become filled. The total cost received by the writing party (or parties) was $85.6K, with a price of $410.0 per contract. There were 1563 open contracts at this strike prior to today, and today 219 contract(s) were bought and sold.

Options Alert Terminology

 - Call Contracts: The right to buy shares as indicated in the contract.

 - Put Contracts: The right to sell shares as indicated in the contract.

 - Expiration Date: When the contract expires. One must act on the contract by this date if one wants to use it.

 - Premium/Option Price: The price of the contract.

For more information, visit our Guide to Understanding Options Alerts or read more about unusual options activity."
2,Tesla's Musk Responds To Wave Of New Electric Vehicle ...,Benzinga,1 hour ago,2021-05-03 19:30:03.358825,"(NASDAQ: AAPL) has long been speculated to make an announcement in this regard, and there were even rumors of partnerships with contract manufacturers ...",https://www.benzinga.com/news/21/05/20917148/teslas-musk-responds-to-wave-of-new-electric-vehicle-manufacturers-prototype-easy-production-hard,"data:image/gif;base64,R0lGODlhAQABAIAAAP///////yH5BAEKAAEALAAAAAABAAEAAAICTAEAOw==","Tesla, Inc. (NASDAQ: TSLA) CEO Elon Musk invariably makes a stir with his tweets, which more often than not are cryptic.

Musk offered a direct response Monday to an observation by a Twitter user about competition heating up in electric vehicle manufacturing.

What Happened: The Twitter user referred to several tech companies making a beeline for EV manufacturing, and Musk's response was plain and logical:

Why It's Important: Most analysts suggest the market for EVs is likely to grow exponentially as EV penetration increases from its current single-digit percentage.

Related Link: Where Are Tesla's Profits Coming From? (Hint: It's Not Cars)

With EV manufacturing now driven by technology that is involved in batteries and accompanying charging infrastructure and autonomous driver assistance systems, several tech companies have also announced plans to enter the market.

Tech giant Apple, Inc. (NASDAQ: AAPL) has long been speculated to make an announcement in this regard, and there were even rumors of partnerships with contract manufacturers and traditional automakers.

Cupertino hasn't said anything concrete about the matter.

Smartphone manufacturer Xiaomi Corporation (OTC: XIACF) confirmed its plan to enter the foray, and so did Huawei, Chinese search engine Baidu, Inc. (NASDAQ: BIDU) and Japanese electronics giant Sony Group Corporation (NYSE: SONY).

Benzinga's Take: As Musk mentioned, scaling up manufacturing is a whole other ball game, especially for those companies with little experience in car manufacturing. The most prudent strategy is to tie up automakers in taking their plan forward, and go solo when they have adequate infrastructure and expertise in place. Related Link: Tesla Chooses Mumbai For First Office, Showroom In India: Report"
3,Is Apple (AAPL) Outperforming Other Computer and ...,Yahoo Finance,2 hours ago,2021-05-03 18:30:03.366802,AAPL is currently sporting a Zacks Rank of #1 (Strong Buy). ... Investors with an interest in Computer and Technology stocks should continue to track AAPL.,https://finance.yahoo.com/news/apple-aapl-outperforming-other-computer-153003984.html,"data:image/gif;base64,R0lGODlhAQABAIAAAP///////yH5BAEKAAEALAAAAAABAAEAAAICTAEAOw==","Investors focused on the Computer and Technology space have likely heard of Apple (AAPL), but is the stock performing well in comparison to the rest of its sector peers? By taking a look at the stock's year-to-date performance in comparison to its Computer and Technology peers, we might be able to answer that question.

Apple is a member of our Computer and Technology group, which includes 621 different companies and currently sits at #9 in the Zacks Sector Rank. The Zacks Sector Rank considers 16 different groups, measuring the average Zacks Rank of the individual stocks within the sector to gauge the strength of each group.

The Zacks Rank is a successful stock-picking model that emphasizes earnings estimates and estimate revisions. The system highlights a number of different stocks that could be poised to outperform the broader market over the next one to three months. AAPL is currently sporting a Zacks Rank of #1 (Strong Buy).

The Zacks Consensus Estimate for AAPL's full-year earnings has moved 1.73% higher within the past quarter. This is a sign of improving analyst sentiment and a positive earnings outlook trend.

Based on the most recent data, AAPL has returned 0.60% so far this year. Meanwhile, stocks in the Computer and Technology group have gained about 13.64% on average. This shows that Apple is outperforming its peers so far this year.

To break things down more, AAPL belongs to the Computer - Mini computers industry, a group that includes 4 individual companies and currently sits at #84 in the Zacks Industry Rank. On average, this group has gained an average of 0.40% so far this year, meaning that AAPL is performing better in terms of year-to-date returns.

Investors with an interest in Computer and Technology stocks should continue to track AAPL. The stock will be looking to continue its solid performance.



Want the latest recommendations from Zacks Investment Research? Today, you can download 7 Best Stocks for the Next 30 Days. Click to get this free report

 

Apple Inc. (AAPL) : Free Stock Analysis Report

 

To read this article on Zacks.com click here."
4,Apple (AAPL) a Favorite to Win a Major Antitrust Trial Against ...,StreetInsider,2 hours ago,2021-05-03 18:30:03.372786,"Wedbush analyst Dan Ives believes Apple (NASDAQ: AAPL) is the favorite to win the legal battle against Epic Games and therefore, defend its “golden jewel ...",https://www.streetinsider.com/Analyst+Comments/Apple+%28AAPL%29+a+Favorite+to+Win+a+Major+Antitrust+Trial+Against+Epic+Games%2C+Wedbushs+Dan+Ives+Says/18351565.html,"data:image/gif;base64,R0lGODlhAQABAIAAAP///////yH5BAEKAAEALAAAAAABAAEAAAICTAEAOw==","Wedbush analyst Dan Ives believes Apple (NASDAQ: AAPL) is the favorite to win the legal battle against Epic Games and therefore, defend its âgolden jewel App Store ecosystem.â

Apple is set to face Fortnite creator Epic Games in an antitrust trial that starts today after the video game company filed a lawsuit that could have an impact on Appleâs App Store business.

Epic Games filed the lawsuit in 2020 in the U.S. District Court for the Northern District of California which is focused on two of Apple practices including its requirement that virtually all third-party software for its devices have to be distributed through its App Store, and the requirement that developers use Apple's in-app purchase system, which charges fees of up to 30%.

Last year, Epic launched its own in-app payment system in Fortnite to avoid Appleâs commissions, which resulted in Apple removing Epic from its App Store. Epic does not seek financial damages but is asking the court to halt many of Appleâs practices.

In response, Epic brought a lawsuit against Apple, accusing the tech giant of abusing its power of app developers by introducing requirements that affect the competition in the software market. The video game maker also initiated a public relations campaign to emphasize its allegations, all while Apple was facing scrutiny from legislators and regulators in the U.S. and other countries.

Ives weighs in and says that Epic opted for a ârisky and calculated pathâ to challenge Apple in times when the US tech giant faces scrutiny both in the US and Europe for its 30% fee structure.

âWhile Epic will play into Fortnite's massive installed base which is unrivaled and drum up support (through social media, etc), legally Apple has successfully defended its App Store moat again and again with this time being no different in our opinion. From an investor perspective, the key services business and its $65 billion+ annual revenue stream for FY21 remain what we estimate is a $1.3 trillion valuation alone for this business and key to future monetization efforts with more bundling efforts on the horizon,â Ives wrote in a memo sent to clients.

A legal battle between these two is highly-anticipated as stakes are very high for both firms. On one side, Apple has to make sure that others donât follow suit and try to break away from the highly-profitable App Store ecosystem. In this context, a negative ruling would be a âmajor gut punchâ for Apple.

âThis is a high stakes game of poker being played as Apple needs to make sure the Epic challenge, which is very timely in light of anti-trust swirls and growing opposition to Big Tech within the Beltway, does not create a ripple effect which developers and regulators globally are watching carefully. We will be watching this trial closely and the ultimate ruling likely in the next three weeks for any ripple effects that could negatively impact the App Store fee structure going forward which we view as fortress-like despite the Epic noise. A negative ruling vs. Apple would be a major gut punch to the App Store crown jewel monetization engine,â concludes Ives."
5,"Notable ETF Inflow Detected - ESGU, AAPL, MSFT, AMZN",,3 hours ago,2021-05-03 17:30:03.384274,"Among the largest underlying components of ESGU, in trading today Apple Inc (Symbol: AAPL) is up about 1.8%, Microsoft Corporation (Symbol: MSFT) is up ...",https://www.nasdaq.com/articles/notable-etf-inflow-detected-esgu-aapl-msft-amzn-2021-05-03,"data:image/gif;base64,R0lGODlhAQABAIAAAP///////yH5BAEKAAEALAAAAAABAAEAAAICTAEAOw==",Missing_Article
